Program, SFU Department or Faculty, Field School, Director, Term, Country, Number of times program has run (including 2022), Number of participants, Undergraduate, Visiting Ugrad, Visiting Grad, SFU Participants: Faculty(ies)
Berlin Contemporary Arts Field School, Contemporary Arts, Contemporary Arts, Sabine Bitter, Summer 2022, Germany, 5, 12, 10, 1, 1, CAT: 11
Curacao Archaeology Field School, Archaeology, Archaeology, Christina Giovas, Summer 2022, Curacao, 1, 7, 5, 2, 0, ARTS: 1, EVN: 5
Finland Urban Sustainability Field School, Urban Studies, Urban Studies, Annika Airas, Meg Holden, Summer 2022, Finland, 1, 9, 4, 0, 5, ARTS: 5, BUS: 1, CAT: 1, ENV: 2
italiaDesign Field School, Interactive Arts and Technology, Interactive Arts and Technology, Russell Taylor, Summer 2022, Italy, 13, 12, 12, 0, 0, CAT: 12
NATO Field School and Simulation Program, Political Science, Political Science, Alex Moens, Summer 2022, Belgium, Italy, Latvia, 4, 41, 12, 22, 7***, ARTS: 12
Portugal Archaeology Field School, Archaeology, Archaeology, Hugo Cardoso, Summer 2022, Portugal, 2, 12, 12, 0, 0, APSC: 1, ARTS: 2, ENV: 1, SCI: 1
